{
  "$schema": "https://json-schema.org/draft/2020-12/schema",
  "$id": "https://gitscale.io/events/identity/agent.created.schema.json",
  "title": "agent.created",
  "description": "Emitted when an AgentIdentity row is inserted. Payload of the identity_outbox row whose event_type = 'agent.created'.",
  "type": "object",
  "additionalProperties": false,
  "required": [
    "agent_id",
    "parent_user_id",
    "display_name",
    "permission_scope",
    "rate_bucket",
    "reputation_score",
    "principal_class",
    "created_at",
    "_envelope_version"
  ],
  "properties": {
    "agent_id": {
      "type": "string",
      "format": "uuid"
    },
    "parent_user_id": {
      "type": "string",
      "format": "uuid"
    },
    "display_name": {
      "type": "string"
    },
    "permission_scope": {
      "type": "array",
      "items": { "type": "string" }
    },
    "rate_bucket": {
      "type": "string"
    },
    "session_quota": {
      "type": ["integer", "null"]
    },
    "tokens_per_week_cap": {
      "type": ["integer", "null"]
    },
    "reputation_score": {
      "type": "number",
      "minimum": 0,
      "maximum": 1
    },
    "quota_account_id": {
      "type": ["string", "null"],
      "format": "uuid"
    },
    "principal_class": {
      "type": "string",
      "const": "agent"
    },
    "created_at": {
      "type": "string",
      "format": "date-time"
    },
    "_envelope_version": {
      "type": "integer",
      "const": 1
    }
  }
}
